{
  "$schema": "http://json-schema.org/draft-07/schema#",
  "type": "array",
  "title": "Project Feature Validation Schema",
  "description": "Schema for validating project setup Features and their status",
  "items": {
    "type": "object",
    "title": "Project Feature Item",
    "description": "A single project Feature category with details",
    "required": ["id","category", "description", "source", "priority", "steps", "passes"],
    "properties": {
	  "id": {
        "type": "integer",
        "title": "Feature ID",
		"minimum": 1,
        "description": "Feature ID is the unique identifier. Start from 1 and increase by a step size of 1",
        "examples": [1, 2, 3]
      },
      "category": {
        "type": "string",
        "title": "Feature Category",
        "description": "The category of the project Feature (e.g., Setup, Build, Test)",
        "examples": ["Setup", "Build", "Deployment", "Testing", "Documentation"]
      },
      "description": {
        "type": "string",
        "title": "Feature Description",
        "description": "Human-readable description of the feature",
        "examples": ["Initialize project with package.json", "Compile TypeScript to JavaScript"]
      },
	  "source": {
        "type": "string",
        "title": "Feature Source",
        "description": "Indicates which planning document this Feature was generated from",
        "examples": ["docs/orchestrator-design-phases.md"]
      },
	  "priority": {
        "type": "string",
        "title": "Feature priority",
        "description": "Task priority: from p0 to p5, the priority decreases gradually. The priority of p0 is the highest, while that of p5 is the lowest.",
        "examples": ["p0", "p1", "p2", "p3", "p4", "p5"]
      },
      "steps": {
        "type": "array",
        "title": "Sub-Steps",
        "description": "List of individual Features under the category, At least one sub-Feature is required",
        "items": {
          "type": "string",
          "examples": ["1. Create package.json", "2. Install dependencies"]
        },
        "minItems": 1
      },
      "passes": {
        "type": "boolean",
        "title": "Feature Pass Status",
        "description": "Whether the Feature category has passed (true) or failed (false)",
        "examples": [true, false]
      }
    },
    "additionalProperties": false
  }
}